{
  "version": 1,
  "id": "evt-system-001",
  "source": "homepi-backend",
  "topic": "system.status",
  "event": "system_status_snapshot",
  "correlationId": "sse-001",
  "timestamp": "2026-05-27T16:00:00.000Z",
  "payload": {
    "snapshot": {
      "uptimeMs": 120000,
      "cpuTempC": 48.2,
      "lastEventAt": "2026-05-27T16:00:00.000Z"
    }
  }
}
